Dia,Mensagem Crua,Resposta
9/16/2025,Vamos criar um jornal a respeito do dia de hoje dia 16 de setembro de 2025 tive uma noite de sono intermitente acordei por volta de umas 4h40 da manhã fiquei enrolando na cama até 5h30 que foi quando eu levantei aqueci uma água pra tomar um chimarrão e fiquei lendo um pouco do livro do Jean Val sobre Sofia e os logos criadores esse trecho do livro falava sobre como a relação dos logos criadores e das entidades demo do universo vizinho são parecidas com as relações do da igreja católica com os devotos no sentido de a Igreja Católica responder muitas coisas referentes as coisas que acontecem na igreja e darem minimizarem a importância de perante público e ele diz que o papa Francisco sabia das coisas que estavam acontecendo na igreja e preferia manter por baixo dos panos pra achando que não faria diferença pras pessoas ele diz que os tem amor que são uma raça uma espécie existente nesse universo vizinho que eles em algum momento já tiveram interface com os humanos Mas que isso sempre foi uma relação de exploração que hoje em dia eles ainda continuam existindo mas que eles não fazem questão de tocar nesse assunto encerrei a leitura desse livro e fui fazer o meu treino pela manhã volto às 6h20 às 7h20 foi um treino bem intenso Retomando o fato de eu ter ficado parado cerca de cinco dias de treinamento quando voltei me preparei pra ter a reunião com a fran a Deli do dia nas quais a gente não abordou notícias mas sim fez uma atualização de como foram os meus dias de viagem como foram as atualizações sobre as consultorias e expliquei pra ela quais são os meus planos em termos de divisão do tempo pras próximas semanas terminando com ela foi diretamente pra Epic school pra ter reunião com o Gustavo e com everton na qual a gente confirmou a parceria na em que eu vou ser o gestor de marketing da Epic School por um período de seis meses como consultor alguns detalhes precisam ser alinhados ainda mas no geral tudo saiu como eu gostaria e nós fomos almoçar almoçar juntos depois disso e ele me apresentou pra equipe tanto pra equipe de gestão quanto para aqueles que eu vou direcionar o Ígor e o Bruno Comecei a pegar algumas tarefas pra poder fazer referente a isso mas tive que voltar pra casa acabei ficando com uma dor de cabeça então deitei pra dar uma descansada ali por volta de umas 3h30 até umas 4h30 não aguentei tive que tomar remédio fui dar uma mandada de cerca de meia hora pra poder espairecer e relaxar a cabeça Quando eu voltei já estava um pouco melhor e era por volta de umas 5h30 6h00 e eu tinha que finalizar o meu preparo da documentação pra conversar com o pessoal do Dr. assistente o Gui não pode falar comigo então eu acelerei algumas tarefas referentes a ao site da Susan Consegui entregar isso pra ela e finalizando isso o Gui teve disponibilidade pra falar comigo e a gente falou por cerca de uma hora pra poder bater o martelo sobre as melhores condições da consultoria e eu vou iniciar na sexta-feira entrando em contato com algumas pessoas da empresa terminando isso já era pro cerca de 8h45 eu fui tomei uma água e organizei minhas tarefas do dia de amanhã tomei um banho e agora deixei pra dormir,"O que estou mais grato hoje?

  - Por ter tido uma reunião bem-sucedida na qual confirmamos a parceria de consultoria de marketing com a Epic School e a reunião com a Dr. Assistant para a consultoria de sexta-feira. Tudo saiu como eu queria.

Exercitei meu corpo hoje?

  - Sim. Fiz um treino intenso pela manhã e, à tarde, fiz uma caminhada de meia hora para relaxar a cabeça.

O que fiz hoje?

  - Acordei cedo, li um livro sobre filosofia, treinei, tive uma reunião com a Fran e a Deli, outra com Gustavo e Everton na Epic School, almocei com eles e conheci a equipe, comecei a pegar algumas tarefas e ajudei a Susan com o site dela. Finalizei o dia preparando a documentação para o pessoal da Dr. Assistant e falando com o Gui para fechar a consultoria.

O que fiz pela minha família ou por outras pessoas hoje?

  - Ajudei a Susan com o site dela e me encontrei com a equipe de gestão da Epic School e os dois funcionários que eu vou direcionar, Igor e Bruno.

O que fiz para ajudar outras pessoas hoje?

  - Ajudei a Susan com o site dela e me encontrei com a equipe de gestão da Epic School e os dois funcionários que eu vou direcionar, Igor e Bruno.

Quanto gastei hoje?

  - Não foi mencionado um valor específico, mas almocei com o pessoal da Epic School.

O que aprendi hoje?

  - Aprendi sobre a relação dos ""logos criadores"" e das ""entidades demo"" do universo vizinho, e como o papa Francisco sabia das coisas que estavam acontecendo na Igreja e preferia manter em segredo.

O que me deixou feliz hoje?

  - A parceria com a Epic School confirmada e o início da consultoria com Dr. assistente.

O que posso melhorar amanhã?

  - Devo tomar mais cuidado com a dor de cabeça e cuidar da saúde para não precisar parar de treinar novamente.

Tarefas a fazer para amanhã?

  - Organizei as tarefas para amanhã e vou iniciar a consultoria com o pessoal da Dr. assistente na sexta-feira."
9/17/2025,Bom vamos fazer o Journal de hoje eu acordei 4h45 não tive uma noite tão legal de sono dormi possivelmente umas 6h00 e acordei umas duas vezes no meio da noite eu lembro de ter acordado cerca de 11h40 e depois perguntei pra Alexa meio-dia e meia-noite e meia eu ainda tava razoavelmente acordado né aí só depois que eu consegui dormir melhor Bem levantei aqueci a água pra poder fazer um chimarrão coloquei roupa pra lavar tirei algumas roupas do varal pra poder dar espaço pra quando as roupas estivessem limpas e eu pendurar aí uma vez que acabou de aquecer a água eu fui comecei a ler a Bíblia li sobre a descendência de Adão passando por Noé e posteriormente indo até Abraão Passando pela Babilônia e chegando até Sodoma e Gomorra depois disso peguei o outro livro o livro do Jean valhan falando de Sofia e os logos criadores aonde a parte que eu lhe hoje e explicava especificamente da do que era o quarto logos falando sobre Sofia e a relação dele com com como avatar e que não era muito bem aquilo que a gente imagina aqui na Terra Depois que eu terminei eu fui treinar treinei de seis às 7h00 da manhã e logo ao fim do treino eu fui direto comprar um pão pra poder tomar um café enquanto eu tomava café ou assistir aula do professor Jean ammg na qual ele falava sobre o que é preciso para ser um grande líder mundial que não é nada disso que a gente imagina sobre bondade e conceito de liderança que nos são ensinados de gestão e de boa vizinhança quando na verdade precisa ser ter tsunami cognitiva falta de empatia com o próximo e lidar com situação de estresse de uma forma natural a aula foi bem boa após isso me preparei pra ter minha reunião com a fran a gente Ficou batendo um papo mais referente a a ótica dela sobre o trabalho e acabamos não fazendo a nossa dele inclusive estou fazendo pouco conteúdo pra eu de táxi deixando mais na mão dela e até porque eu não consegui ainda ver questão dos anúncios finalizei ele por volta de 9h30 me senti um pouco cansado de ter acordado muito cedo e ao invés de ir fazer minha power Tarque empurrando as tarefas um pouquinho pra frente e a partir de umas 10h20 10h30 de fato comecei a fazer as tarefas que eu me propus primeiro de ajustar os contratos com a Epic tanto contrato de serviço quanto termo de confidencialidade Posteriormente foi almoçar fiz 11 frango com ovo com linguiça coloquei num pão também preparei aipim e brócolis enquanto eu almoçava fiquei assistindo Daniel lápis na live do YouTube que ele costuma fazer pelo período de meio-dia à uma e após esse período eu me preparei pra reunião que eu tive com o Gabriel que foi às 3h00 Foi uma reunião boa ele falou bastante sobre os projetos com a parte da Codirect e eu falei pra ele sobre como funciona o GIG apps e como ele pode utilizar isso pra clínica e ficou de me dar um retorno antes disso eu esqueci de mencionar que eu fiquei desenvolvendo a proposta para o Mauricio da Pandora Ele me perguntou sobre o Chatbot de atendimento humanizado com I a e eu montei uma proposta pra ele enviei mas ele não respondeu aí após a reunião com o Gabriel eu foquei em montar toda documentação para apresentação de marketing desde a estratégia de marketing na Epic onde eu falei sobre essência do do do negócio cliente ideal Passando pelos pontos de autoridade da empresa e explicando o processo de transição de uma escola de design pra uma escola de tecnologia também abordei as estratégias de marketing seja de posicionamento distribuição conteúdo tráfego após isso eu montei as apresentações em html eu fiz três apresentações uma para as estratégias outra pra explicar ao Gustavo amanhã sobre como é a dinâmica do trabalho e montei uma terceira apresentação que era calendário de eventos até o fim do ano pra poder mostrar pra equipe amanhã pra finalizar eu montei uma linha editorial até o fim de outubro e subi no Notion todos os processo levou um bom tempo então volta do mais 8h40 desse pra poder ligação né e desci propriamente dito depois pra sauna por volta de 9h50 Foi quando eu encerrei tudo esqueci de mencionar também que por volta de umas seis e pouca fui comprar pão novamente e fiz um lanche da tarde por fim às 21h50 às 10h10 eu fiquei na sauna meditei na sauna e fiz as anotações das tarefas de amanhã Agora subi e vou dormir,"O que estou mais grato hoje?

Fico grato por ter tido um dia extremamente produtivo e por ter conseguido montar toda a documentação, propostas e apresentações para os projetos de marketing da Epic. A quantidade de trabalho concluído me deixou muito satisfeito.

Exercitei meu corpo hoje?

Sim. Treinei de 6h00 às 7h00 da manhã e, à noite, fiz uma sessão de sauna e meditação.

O que fiz hoje?

Acordei cedo, fiz um chimarrão e organizei a lavanderia. Li a Bíblia e o livro do Jean Valhan. Fui para a academia, comprei pão e tomei café assistindo a uma aula. Tive uma reunião com a Fran e depois foquei em minhas tarefas, como ajustar contratos com a Epic e desenvolver uma proposta para o Maurício da Pandora. Almocei assistindo a uma live no YouTube e depois tive uma reunião com o Gabriel. Foquei em montar a documentação de marketing para a Epic (estratégia, apresentações em HTML e linha editorial) e, para finalizar o dia, fui para a sauna e meditei.

O que fiz para ajudar outras pessoas hoje?

Ajudei na preparação de conteúdo para a Fran, desenvolvi uma proposta para o Maurício da Pandora e organizei a documentação para a apresentação de marketing para a equipe da Epic.

Quanto gastei hoje?

Não foi mencionado um valor específico, mas você comprou pão duas vezes.

O que aprendi hoje?

Aprendi sobre a genealogia bíblica, de Adão a Abraão, e sobre o que é preciso para ser um líder, segundo o professor Jean A.M.G. Também entendi um pouco mais sobre o ""quarto logos"" no livro do Jean Valhan.

O que me deixou feliz hoje?

Fiquei feliz em ver todo o trabalho que consegui fazer para a Epic, desde a estratégia até as apresentações, e por ter tido uma boa reunião com o Gabriel.

O que posso melhorar amanhã?

Você pode tentar ter uma noite de sono mais consistente. Além disso, evite adiar suas tarefas principais (""power tasks""), mesmo se sentir cansaço, para ser ainda mais produtivo.

Tarefas a fazer para amanhã?

Você mencionou que as tarefas para amanhã foram anotadas. Pelo contexto, o plano é apresentar as dinâmicas de trabalho ao Gustavo e o calendário de eventos à equipe da Epic."
9/18/2025,Vamos fazer o nosso jornal de hoje seguindo o mesmo modelo de templo do que tem acima hoje o meu dia dia acordou hoje o meu dia começou 4h19 da manhã quando eu acordei mas no susto do que na intenção de acordar quando eu levantei era cerca de 4h45 Então eu retornei a dormir na hora que eu acordei às 4h19 até as 4h45 naquele sono meio inicial e aí após levantar eu fui liguei o fogo pra esquentar uma água e preparar um chimarrão nesse meio tempo organizei as minhas coisas pra começar a ler tão li a Bíblia de 5h00 às 5h30 e dessa vez eu percorri a história de Isaac filho de Abraão com Sara inicialmente teve um filho junto com uma serva chamado Ismael e Sara não ficou muito contente porque a serva começou a tratar lá mal mesmo tendo sido Sara a pessoa recomendar que abram dormisse com a serva Eles criou um atrito até que Abraão recebeu uma mensagem divina dizendo que seria pai mesmo tendo bastante idade já nessa época com 99 anos com 100 anos então ele tem o seu filho com Sara e começa a história do descendência Abraham mica por um lado no qual Isaac se desenvolve e começa a ter filhos e descendentes e assim por diante em um determinado momento abra um resolvi expulsar a serva que eu não me recordo o nome junto com Ismael justamente porque Sarah quis que ele fizesse isso Então a história se desenrola abra um encontro um rei e esse rei acaba dizendo que Abraão mentiu pra ele porque Abraão ele disse que não era marido mas sim irmão de Sara isso fez com que o rei quisesse tê-la só que o rei descobre isso e fica triste com Abraão só que Abraão explica o motivo pelo qual ele fez isso e ele acaba presenteando morrer com bois e outros animais a segunda parte da história se desenrola com a história da premonição sobre Deus destruir Sodoma e Gomorra Abraão tenta avisar mas o pessoal não dá muita bola pra ele até que um dia de fato as coisas acontecem dessa maneira eu não sei se Abraão de fato Mas enfim questão é que essa foi história não lembro muito bem e aí eu consegui andar até essa parte da linhagem em Abraham foi aonde eu consegui terminar a Bíblia minha leitura da Bíblia cerca de 5h30 eu comecei a ler o livro do Jawal sobre Sofia os logos criadores a explicação dessa vez foi muito pautada nas condições Dos seres Demus do universo em que ele costuma tratar falando sobre a relação entre Brahma visto no e Shiva como os seres da tribute inicial e ele fala sobre as condições aditava e a digenar Cado que nós teoria teríamos uma seríamos fractais de 11 elo divino em uma determinada condição chamada adia ou algo nesse sentido e que a condição adi dava da gente seria como se nós tivéssemos aprisionado dentro de um corpo avatar né e a nossa forma de se expressar forma desse avatar se expressar e vendo outros fatais que em teoria seriam seriam nossas consciências é um pouco pouco do resumo que eu tenho aí eu parei e fui treinar por volta das 6h10 treinei até cerca de 7h00 quando eu voltei e me aprontei pra poder ir pra época school Antes disso eu fiz a barba e tomei um banho fiquei cerca de 20 minutos tentando estacionar ali próximo não consegui estacionamento fácil acabei estacionando um pouco longe mas peguei um patinete pra poder conseguir chegar até app de forma mais rápida então eu chego ele por volta de umas 8h10 Gustavo tinha aberto a escola eu tive Uma conversa rápida com ele que me convidou pra participar de um evento na sif então meu planejamento inicial que era de conversar com ele sobre contratos e outras coisas afins acabou ficando pra um outro dia já que ele não estaria mais ali na parte da tarde então eu fui num evento com ele Foi um evento que tratou ali sobre núcleo de Educação da sif e houve um bate-papo dinâmicas apresentações e então me trouxe até a época novamente onde eu avancei com alguns algumas tarefas mas em especial você vai ter um papo com everton que me passou muitas informações sobre a escola e acabei tendo um papo longo com ele que me impediu de almoçar aí como eu tinha uma reunião cerca de uma hora com o Bruno e com o Igor que são os dois estagiários de mídia eu acabei tendo uma reunião com eles por volta de umas 1h30 já que o Igor atrasou um pouco até umas 2h30 Saindo disso conversei com a Giane que me situou sobre o contexto dos meninos ali e a partir disso eu voltei pra casa pra poder adiantar algumas outras tarefas que não conseguimos em tempo hábil na verdade acabei deitando no sofá após comer um lanche que eu fiz pra poder assassinar a fome que foi pão com ovo com linguiça e com frango Posteriormente esse descanso eu já tinha duas reuniões engatilhadas uma delas com o Aurélio pra me explicar a respeito dos anúncios e tráfego feito pra Epic school e em seguida com o Gui Minaré pra me atualizar a respeito da parte de marketing gestão de tráfego que começou às 7h00 e foi até as 8h10 e já saí na correria pra poder ir na casa da Ju junto com Matheus e ainda pra jantar Então foi um bate-papo bem legal pra ele e por fim voltei pra casa tomei um banho estou deitado aqui falando sobre meu dia,"O que estou mais grato hoje?

Por ter tido um dia tão produtivo e cheio de aprendizados e conexões profissionais. As reuniões e o evento na SIF foram muito importantes para o trabalho na Epic.

Exercitei meu corpo hoje?

Sim, treinei das 6h10 às 7h00 da manhã.

O que fiz hoje?

Acordei cedo, fiz um chimarrão e li a Bíblia e o livro do Jean Valhan. Fui para a academia, me arrumei e fui para a Epic School. Lá, conversei com o Gustavo e fomos para um evento na SIF. Retornei para a Epic e tive um longo papo com o Everton. Depois, me reuni com o Bruno e o Igor e, em seguida, com a Giane. Voltei para casa, descansei e tive duas reuniões: uma com o Aurélio e outra com o Gui Minaré. Para finalizar o dia, fui jantar na casa da Ju com o Matheus.

O que fiz para ajudar outras pessoas hoje?

Direcionei o Bruno e o Igor, além de conversar com o Aurélio e o Gui Minaré sobre as estratégias de marketing. Também participei de um evento da SIF junto com o Gustavo.

Quanto gastei hoje?

Não foi mencionado um valor específico, mas usei um patinete e saiu para jantar.

O que aprendi hoje?

Aprendi sobre a história de Isaac e Abraão na Bíblia e, no livro de Jean Valhan, sobre os seres Demus e os conceitos de aditava e adijanakado. Além disso, adquiri informações importantes sobre a Epic School e seus projetos.

O que me deixou feliz hoje?

A experiência de ir ao evento na SIF, o aprendizado com as reuniões e a oportunidade de relaxar no final do dia com um jantar na casa da Ju.

O que posso melhorar amanhã?

Você pode tentar ter uma noite de sono mais consistente. E, se possível, melhorar o gerenciamento de tempo para conseguir almoçar, já que hoje você pulou o almoço por causa das reuniões.

Tarefas a fazer para amanhã?

A reunião sobre os contratos da Epic foi adiada. O plano é retomar essa conversa em outro dia."
9/19/2025,Eu queria fazer o meu Journal de ontem que eu acabei não fazendo qual eu acordei 4h45 da manhã novamente mais um dia que eu fui bem disciplinado em acordar cedo e acabei lendo a Bíblia uma parte onde explica a história do filho de Abraão Isaac e também de toda relação que ele tem com Rebeca de ele acabar enganando o rei de ele ter toda a parte de relacionamento né de cortejo em relação a encontrar a esposa onde o servo de Abraão vai até determinada região pra poder encontrar a esposa e coisas nesse sentido além de Ismael também né que é o filho de Abraão com outra esposa que no fim das contas tem a ver com a história dele também depois cerca de 5h40 comecei a ler o livro de Sophie logo os criadores do João na parte em que ele começa a falar sobre como visto na sua condição gerou Sofia gerou posteriormente gerou a versão de Jesus e toda a distinção dessa relações em relação a pensamento dos humanos atualmente e como isso se reflete em certas ignorâncias das nossas sociedade hoje em dia por conta de não existir uma explicação documentada sobre isso posteriormente eu acabei descendo pra treinar por volta de umas 6h10 só que logo em seguida o Porto Dr. Assistente me mandou mensagem pedindo pra eu poder ter uma reunião com ele e aí eu acabei subindo novamente pra poder conversar a gente ficou conversando ali até possivelmente umas sete e pouco sobre as funções que eu uso ensino Dr. Assistente como gestor de marketing de influenciado e que ele ia me conectar com a Larissa assim possível então eu fui treinar a partir disso logo ali por volta 7h10 fiquei até umas oito treinando quando eu voltei eu tive um bate-papo com o Gui e a Larissa a Larissa se apresentou a Lola e posteriormente a partir disso eu fui e conversei com a fran de nove às 10 e pouco então a gente conseguiu bater esse papo foi meio corrido e tal mas a gente não conseguiu fazer nossa nossa dele mas conseguiu avançar ali com algumas discussões interessantes e específico acabei depois entrando numa reunião 10h30 até 11h30 da foi bem corrido a partir da manhã e logo em seguida eu tirei um tempinho pra poder dar uma tranquilizada na mente e fiquei até cerca de 11h30 meio dia aguardando o tempo até fazer minha comida aí comecei a fazer comida ao mesmo tempo comecei a assistir Daniel Lopez e almocei a comida que eu já tinha pronta eu posteriormente ali por volta de 1h30 acabei conversando com o Gui também a gente falou sobre a Michele e ele me apresentou e posteriormente ela me explicou como era a dinâmica de trabalho dela eu tive que ainda montar uns documentos ali tentei fazer uma ligação pra poder reagendar o meu cardiologista e não conseguia vou deixar pra segunda e por fim pra poder matar a última reunião do dia eu com a Luciana pra ela poder explicar como é que é a dinâmica comercial do Dr. Assistente acabando as minhas tarefas eu fui encontrar com a Juliana pra poder tomar um chimarrão e acabei combinando com a Sabrina de jogar um beach tênis e saindo pra poder comer acabei voltando pra casa aí por volta de umas 11h00 da noite,"O que estou mais grato hoje?

Agradeço por ter mais um dia de disciplina ao acordar cedo. Fui produtivo e consegui lidar com múltiplas reuniões e tarefas profissionais.

Exercitei meu corpo hoje?

Sim. Treinei das 7h10 às 8h00.

O que fiz hoje?

Acordei cedo, li a Bíblia e o livro sobre Sofia e os logos criadores. Tive uma reunião com o Dr. Assistente, depois treinei. Em seguida, conversei com Gui e Larissa, com a Fran, e tive outra reunião das 10h30 às 11h30. Fiz o almoço enquanto assistia a um vídeo, e tive reuniões com o Gui (conheci a Michele) e com a Luciana. No fim do dia, encontrei a Juliana para um chimarrão e joguei beach tennis com a Sabrina, antes de jantar e voltar para casa.

O que fiz para ajudar outras pessoas hoje?

Participei de diversas reuniões para contribuir com o trabalho do Dr. Assistente, conversando com Gui, Larissa, Michele e Luciana. Também tive um bate-papo de trabalho com a Fran.

Quanto gastei hoje?

Não foi mencionado um valor específico, mas você saiu para comer após o beach tennis.

O que aprendi hoje?

Aprendi mais sobre a história de Isaac e a descendência de Abraão na Bíblia. No livro do Jean Valhan, entendi a relação entre Vishnu, Sofia e Jesus, e como isso se reflete na ignorância humana. No trabalho, aprendi sobre as funções de um gestor de marketing/influencers e a dinâmica comercial do Dr. Assistente.

O que me deixou feliz hoje?

Os momentos de lazer no final do dia, como o chimarrão com a Juliana e a partida de beach tennis com a Sabrina, foram um ótimo escape do dia corrido.

O que posso melhorar amanhã?

O dia foi muito corrido com reuniões. Pode ser útil gerenciar o tempo de forma mais eficaz para ter mais fluidez entre as tarefas. Além disso, não consegui ligar para o cardiologista, então essa tarefa precisa ser priorizada.

Tarefas a fazer para amanhã?

Ligar para o cardiologista para reagendar a consulta na segunda-feira."
